<?xml version="1.0" encoding="utf-8"?>

<!ELEMENT Distinctions ANY>
<!ELEMENT Name (#PCDATA)>
<!ELEMENT description (#PCDATA)>
<!ELEMENT phone (#PCDATA)>
<!ATTLIST phone type (work|cell) #REQUIRED>
<!ATTLIST phone primary (primary) #IMPLIED>
<!ELEMENT email (#PCDATA)>

<!ELEMENT Distinction (Name, description, phone+, email?)>
