<?xml version="1.0" encoding="utf-8"?>
<!DOCTYPE Distinctions SYSTEM "distinctions.dtd">

<Distinctions>
	<Distinction>
		<Name>Rick Chubb</Name>
		<description>School District</description>
		<phone type="work" primary="primary">(763)767-1804</phone>
		<phone type="cell">(612) 290-5579</phone>
		<email>randdchubb@aol.com</email>
	</Distinction>

	<Distinction>
		<Name>Rick Chubb</Name>
		<description>Potential Employee</description>
		<phone type="work" primary="primary">(763)767-1804</phone>
		<phone type="cell">(612) 290-5579</phone>
		<email>randdchubb@aol.com</email>
	</Distinction>

	<Distinction>
		<Name>Doris Chubb</Name>
		<description> Current Drivers</description>
		<phone type="work" primary="primary">(763)767-1804</phone>
		<phone type="cell">(612) 290-5577</phone>
		<email>dorischubb@yahoo.com</email>
	</Distinction>

	<Distinction>
		<Name>Doris or Rick Chubb</Name>
		<description>New Clients</description>
		<phone type="work" primary="primary">(763)767-1804</phone>
		<email>randdchubb@aol.com</email>
	</Distinction>

</Distinctions>
